title,source_country,date,url,clean_text,headline_length_words,month
"İsrail ordusu , Batı Şeriada düzenlediği baskınlarda 26 Filistinliyi gözaltına aldı",Turkey,2026-03-15 10:30:00,http://www.haberler.com/guncel/israil-ordusu-bati-seria-da-26-filistinliyi-gozaltina-aldi-19659768-haberi/,i srail ordusu batı şeriada düzenlediği baskınlarda 26 filistinliyi gözaltına aldı,11,2026-03
"İspanya , İsraili sert bir dille kınadı",Turkey,2026-03-16 13:00:00,https://www.yeniasya.com.tr/dunya/ispanya-israil-i-sert-bir-dille-kinadi_620553,i spanya i sraili sert bir dille kınadı,8,2026-03
بنك فلسطين وجمعية عطاء فلسطين يوزعان وجبات إفطار للأسر المتضررة في غزة ضمن حملة  رمضان يجمعنا بالحب والعطاء  – تلفزيون الفجر,Israel,2026-03-15 20:30:00,https://alfajertv.com/news/palnews/722810.html,بنك فلسطين وجمعية عطاء فلسطين يوزعان وجبات إفطار للأسر المتضررة في غزة ضمن حملة رمضان يجمعنا بالحب والعطاء تلفزيون الفجر,20,2026-03
İsrail ordusu işgal altındaki Batı Şeriada 5 Filistinliyi yaraladı,Turkey,2026-03-04 22:30:00,http://www.haberler.com/guncel/israil-ordusu-bati-seria-da-baskin-duzenledi-5-yarali-19625535-haberi/,i srail ordusu işgal altındaki batı şeriada 5 filistinliyi yaraladı,10,2026-03
PCBS says Consumer Price Index ( CPI ) slightly increased in Gaza and the West Bank,Israel,2026-03-12 09:45:00,https://english.wafa.ps/Pages/Details/168255,pcbs says consumer price index cpi slightly increased in gaza and the west bank,14,2026-03
İspanyadan İsraile sert tepki ! ,Turkey,2026-03-15 21:00:00,https://www.kocaeligazetesi.com.tr/haber/27637853/ispanyadan-israile-sert-tepki,i spanyadan i sraile sert tepki,6,2026-03
Forty nations meet in The Hague to discuss measures against Israel West Bank annexation,Israel,2026-03-04 17:15:00,https://www.middleeasteye.net/news/forty-nations-convene-hague-discuss-measures-against-israels-annexation-west-bank,forty nations meet in the hague to discuss measures against israel west bank annexation,14,2026-03
BM : Gazzeye son iki günde  neredeyse tüm insani yardım hareketleri engellendi  ,Turkey,2026-03-13 18:30:00,http://www.haberler.com/guncel/bm-israil-gazze-ye-insani-yardimlari-engelliyor-19655496-haberi/,bm gazzeye son iki günde neredeyse tüm insani yardım hareketleri engellendi,11,2026-03
Arap ülkelerinden son dakika İsrail bildirisi ! Tüm dünyaya kritik mesaj,Turkey,2026-03-15 18:30:00,https://www.haber7.com/dunya/haber/3612277-arap-ulkelerinden-son-dakika-israil-bildirisi-tum-dunyaya-kritik-mesaj,arap ülkelerinden son dakika i srail bildirisi tüm dünyaya kritik mesaj,11,2026-03
بنك فلسطين وجمعية عطاء فلسطين يوزعان وجبات إفطار للأسر المتضررة في غزة ضمن حملة  رمضان يجمعنا بالحب والعطاء  ,Israel,2026-03-15 15:45:00,https://pnn.ps/news/720688,بنك فلسطين وجمعية عطاء فلسطين يوزعان وجبات إفطار للأسر المتضررة في غزة ضمن حملة رمضان يجمعنا بالحب والعطاء,18,2026-03
Gazzenin Tarihsel Arka Planı ve 7 Ekime Giden Süreç - Dr . Bilal TANRIVERDİ,Turkey,2026-03-03 07:15:00,https://www.risalehaber.com/bilal-tanriverdi-gazzenin-tarihsel-arka-plani-ve-7-ekime-giden-surec-28702yy.htm,gazzenin tarihsel arka planı ve 7 ekime giden süreç dr bilal tanriverdi,12,2026-03
BM açıkladı : Gazzede tüm insani yardım hareketleri engellendi,Turkey,2026-03-13 21:15:00,https://dogruhaber.com.tr/bm-acikladi-gazzede-tum-insani-yardim-hareketleri-engellendi,bm açıkladı gazzede tüm insani yardım hareketleri engellendi,8,2026-03
  Suudi Arabistan ve Katar  ı bombalamayı planlayan Mossad ajanları tutuklandı  ,Turkey,2026-03-03 13:00:00,https://www.timeturk.com/ceviri/suudi-arabistan-ve-katar-i-bombalamayi-planlayan-mossad-ajanlari-tutuklandi-haber-1829410,suudi arabistan ve katar ı bombalamayı planlayan mossad ajanları tutuklandı,10,2026-03
BM : Gazzede 2 günde tüm insani yardım hareketler engellendi,Turkey,2026-03-13 22:30:00,https://www.haksozhaber.net/bm-gazzede-2-gunde-tum-insani-yardim-hareketler-engellendi-201327h.htm,bm gazzede 2 günde tüm insani yardım hareketler engellendi,9,2026-03
İsrail askerlerinin Gazzede açtığı ateş sonucu bir Filistinli hayatını kaybetti,Turkey,2026-03-06 13:45:00,https://www.aa.com.tr/tr/dunya/israil-askerlerinin-gazzede-actigi-ates-sonucu-bir-filistinli-hayatini-kaybetti/3852830,i srail askerlerinin gazzede açtığı ateş sonucu bir filistinli hayatını kaybetti,11,2026-03
השעיית החייל : בלבול ערכי מסוכן,Israel,2026-03-08 22:15:00,https://www.inn.co.il/news/691732,השעיית החייל בלבול ערכי מסוכן,5,2026-03
الاتحاد الأوروبي : تقديم 458 مليون يورو مساعدات إنسانية للشرق الأوسط,Egypt,2026-03-16 14:15:00,https://www.elwatannews.com/news/details/8247204,الاتحاد الأوروبي تقديم 458 مليون يورو مساعدات إنسانية للشرق الأوسط,10,2026-03
Palestinian leader and Pope talk of  alarming developments  ,United States,2026-03-16 17:30:00,https://aleteia.org/2026/03/16/palestinian-leader-calls-pope-leo-talk-of-alarming-developments/,palestinian leader and pope talk of alarming developments,8,2026-03
"Weekly Briefing : Trump and Netanyahu miscalculated , and now theyre going to find out – Mondoweiss",Israel,2026-03-15 16:30:00,https://mondoweiss.net/2026/03/weekly-briefing-trump-and-netanyahu-miscalculated-and-now-theyre-going-to-find-out/,weekly briefing trump and netanyahu miscalculated and now theyre going to find out mondoweiss,14,2026-03
إصابة 6 فلسطينيين خلال اقتحامات إسرائيلية بالضفة الغربية,Israel,2026-03-12 06:15:00,http://zamnpress.com/news/140605,إصابة 6 فلسطينيين خلال اقتحامات إسرائيلية بالضفة الغربية,8,2026-03
"Iran war shifts Middle East dynamics , leaving Palestinian issues sidelined",United States,2026-03-12 17:00:00,https://www.yahoo.com/news/articles/iran-war-shifts-middle-east-223414256.html,iran war shifts middle east dynamics leaving palestinian issues sidelined,10,2026-03
"İsrail , bir Filistinlinin evini patlayıcılarla hedef aldı",Turkey,2026-03-14 18:15:00,https://www.ensonhaber.com/dunya/israil-bir-filistinlinin-evini-patlayicilarla-yikti,i srail bir filistinlinin evini patlayıcılarla hedef aldı,8,2026-03
BM : Filistin topraklarında yardım görevlileri ve siviller hala bombardıman ve ateş altında,Turkey,2026-03-07 14:45:00,https://www.haksozhaber.net/bm-filistin-topraklarinda-yardim-gorevlileri-ve-siviller-hala-bombardiman-ve-ates-al-201050h.htm,bm filistin topraklarında yardım görevlileri ve siviller hala bombardıman ve ateş altında,12,2026-03
محمد هشام عبية لـ فيتو : ردود الأفعال الإسرائيلية على  صحاب الأرض  أسعدت فريق المسلسل,Egypt,2026-03-13 12:30:00,https://www.vetogate.com/5609730,محمد هشام عبية لـ فيتو ردود الأفعال الإسرائيلية على صحاب الأرض أسعدت فريق المسلسل,14,2026-03
הבעיה הפלסטינית תתפוצץ אחרי המלחמה עם איראן | דניאל פרידמן,Israel,2026-03-07 21:30:00,https://www.maariv.co.il/news/opinions/article-1292501,הבעיה הפלסטינית תתפוצץ אחרי המלחמה עם איראן דניאל פרידמן,9,2026-03
إسرائيل على حافة الهاوية,Israel,2026-03-14 19:45:00,https://alghad.com/Section-171/%D8%AA%D8%B1%D8%AC%D9%85%D8%A7%D8%AA/%D8%A5%D8%B3%D8%B1%D8%A7%D8%A6%D9%8A%D9%84-%D8%B9%D9%84%D9%89-%D8%AD%D8%A7%D9%81%D8%A9-%D8%A7%D9%84%D9%87%D8%A7%D9%88%D9%8A%D8%A9-2067706,إسرائيل على حافة الهاوية,4,2026-03
BM : Filistin topraklarında yardım görevlileri ve siviller hala bombardıman ve ateş altında,Turkey,2026-03-06 21:15:00,https://www.aa.com.tr/tr/dunya/bm-filistin-topraklarinda-yardim-gorevlileri-ve-siviller-hala-bombardiman-ve-ates-altinda/3853354,bm filistin topraklarında yardım görevlileri ve siviller hala bombardıman ve ateş altında,12,2026-03
Dismayed by USM cancellation of Palestine conference,United States,2026-03-07 22:15:00,https://www.pressherald.com/2026/03/07/dismayed-by-usm-cancellation-of-palestine-conference-letter/,dismayed by usm cancellation of palestine conference,7,2026-03
İsveç  te İsrailin işgal altındaki Batı Şeriayı ilhak etme kararı protesto edildi,Turkey,2026-03-07 15:45:00,https://www.aa.com.tr/tr/dunya/isvecte-israilin-isgal-altindaki-bati-seriayi-ilhak-etme-karari-protesto-edildi/3854099,i sveç te i srailin işgal altındaki batı şeriayı ilhak etme kararı protesto edildi,14,2026-03
"Filistin topraklarını gasbeden İsrailliler , Batı Şeriada Filistinlileri darbetti hayvanlarını çaldı - Yeni Meram - Konya Haberleri",Turkey,2026-03-13 16:30:00,https://www.yenimeram.com.tr/filistin-topraklarini-gasbeden-israilliler-bati-seriada-filistinlileri-darbetti-hayvanlarini-caldi.htm,filistin topraklarını gasbeden i srailliler batı şeriada filistinlileri darbetti hayvanlarını çaldı yeni meram konya haberleri,15,2026-03
Health Minister discusses strengthening cooperation with WHO representative,Israel,2026-03-10 00:00:00,https://english.wafa.ps/Pages/Details/168155,health minister discusses strengthening cooperation with who representative,8,2026-03
Dismayed by USM cancellation of Palestine conference,United States,2026-03-07 21:45:00,https://www.centralmaine.com/2026/03/07/dismayed-by-usm-cancellation-of-palestine-conference-letter/,dismayed by usm cancellation of palestine conference,7,2026-03
OPINION - Trump Gaza Plan : A blueprint for entrenching colonial power,Turkey,2026-03-02 14:00:00,https://www.aa.com.tr/en/opinion/opinion-trumps-gaza-plan-a-blueprint-for-entrenching-colonial-power/3842044,opinion trump gaza plan a blueprint for entrenching colonial power,10,2026-03
Who Will Govern Gaza ? | Council on Foreign Relations,United States,2026-03-13 21:45:00,https://www.cfr.org/articles/who-will-govern-gaza,who will govern gaza council on foreign relations,8,2026-03
"4 children , pregnant woman dead as Israel kills 8 in W . Bank , Gaza",Turkey,2026-03-15 14:30:00,https://www.dailysabah.com/world/mid-east/4-children-pregnant-woman-dead-as-israel-kills-8-in-w-bank-gaza,4 children pregnant woman dead as israel kills 8 in w bank gaza,13,2026-03
UN chief warns of Israeli - made humanitarian crisis in Gaza amid war on Iran,United States,2026-03-03 16:45:00,https://www.aljazeera.com/news/2026/3/3/un-chief-warns-of-israeli-made-humanitarian-crisis-in-gaza-amid-war-on-iran,un chief warns of israeli made humanitarian crisis in gaza amid war on iran,14,2026-03
What It Took for Film Director Cherien Dabis to  Find Palestine Everywhere But Palestine  ,United States,2026-03-06 09:30:00,https://www.cntraveler.com/story/what-it-took-for-film-director-cherien-dabis-to-find-palestine-everywhere-but-palestine,what it took for film director cherien dabis to find palestine everywhere but palestine,14,2026-03
تزامنًا مع العدوان على إيران .. الاحتلال يحول قرى الضفة ومدنها إلى سجون مغلقة,Israel,2026-03-04 07:15:00,http://zamnpress.com/news/140552,تزامن ا مع العدوان على إيران الاحتلال يحول قرى الضفة ومدنها إلى سجون مغلقة,14,2026-03
"İsrail , Batı Şeriada neden sorun çıkarmaya çalışıyor ? ",Turkey,2026-03-12 18:15:00,https://www.haksozhaber.net/israil-bati-seriada-neden-sorun-cikarmaya-calisiyor-201271h.htm,i srail batı şeriada neden sorun çıkarmaya çalışıyor,8,2026-03
Brian Eno and 200+ Artists Urge British Museum to  Stop Erasing Palestine  ,United States,2026-03-13 00:15:00,https://hyperallergic.com/brian-eno-and-200-artists-urge-british-museum-to-stop-erasing-palestine/,brian eno and 200 artists urge british museum to stop erasing palestine,12,2026-03
"İsrail ordusu , Batı Şeriadaki Asker Kadim Mülteci Kampına baskın düzenledi",Turkey,2026-03-02 12:00:00,https://www.haksozhaber.net/israil-ordusu-bati-seriadaki-asker-kadim-multeci-kampina-baskin-duzenledi-200810h.htm,i srail ordusu batı şeriadaki asker kadim mülteci kampına baskın düzenledi,11,2026-03
İsrail Kudüste 300 binden fazla bireysel silah ruhsatı başvurusuna izin verdi,Turkey,2026-03-09 14:15:00,http://www.haberler.com/guncel/israil-de-bakan-ben-gvir-den-silah-ruhsati-kolayligi-19640684-haberi/,i srail kudüste 300 binden fazla bireysel silah ruhsatı başvurusuna izin verdi,12,2026-03
"Palestinian man killed , brother critically wounded by illegal Israeli settlers in West Bank",Israel,2026-03-07 20:30:00,https://www.middleeastmonitor.com/20260307-palestinian-man-killed-brother-critically-wounded-by-illegal-israeli-settlers-in-west-bank/,palestinian man killed brother critically wounded by illegal israeli settlers in west bank,13,2026-03
"TİKA , ramazanda Filistinde 200 tondan fazla gıda desteği sağladı",Turkey,2026-03-06 11:00:00,https://www.haberler.com/guncel/tika-ramazanda-filistin-de-200-tondan-fazla-gida-19630555-haberi/,ti ka ramazanda filistinde 200 tondan fazla gıda desteği sağladı,10,2026-03
وزارة شئون المرأة الفلسطينية : تسجيل أكثر من 12 ألف حالة إجهاض منذ بدء العدوان على غزة,Egypt,2026-03-07 18:30:00,https://www.shorouknews.com/news/view.aspx?cdate=07032026&id=2bb5d04b-e030-4000-9694-ce1ee2949154,وزارة شئون المرأة الفلسطينية تسجيل أكثر من 12 ألف حالة إجهاض منذ بدء العدوان على غزة,16,2026-03
في اليوم العالمي للسمع .. بنك القدس يوقع شراكة مع فكر فلسطين لدعم المشروع الوطني للسمع ودعم أطفال غزة,Israel,2026-03-08 16:15:00,https://www.raya.ps/raya-tube/1213291.html,في اليوم العالمي للسمع بنك القدس يوقع شراكة مع فكر فلسطين لدعم المشروع الوطني للسمع ودعم أطفال غزة,18,2026-03
"Care packages , brought to Palestinians by colonialism",Israel,2026-03-05 21:15:00,https://www.middleeastmonitor.com/20260305-care-packages-brought-to-palestinians-by-colonialism/,care packages brought to palestinians by colonialism,7,2026-03
BM : Gazzeye son iki günde  neredeyse tüm insani yardım hareketleri engellendi  ,Turkey,2026-03-13 19:30:00,https://www.haberler.com/guncel/bm-den-gazze-ye-insani-yardim-cagrisi-19655669-haberi/,bm gazzeye son iki günde neredeyse tüm insani yardım hareketleri engellendi,11,2026-03
"Filistin topraklarını gasbeden İsrailliler , Batı Şeriada 11 Filistinli aileyi yerinden etti",Turkey,2026-03-08 19:45:00,https://www.haberler.com/guncel/israil-in-bati-seria-daki-saldirilari-11-filistinli-aileyi-yerinden-etti-19638275-haberi/,filistin topraklarını gasbeden i srailliler batı şeriada 11 filistinli aileyi yerinden etti,12,2026-03
وزارة شؤون المرأة تصدر ورقة تحليلية حول واقع النساء في الاقتصاد الفلسطيني أذار 2025 – آذار 2026 - شبكة فلسطين للأنباء,Israel,2026-03-01 17:45:00,https://www.shfanews.net/post/267835,وزارة شؤون المرأة تصدر ورقة تحليلية حول واقع النساء في الاقتصاد الفلسطيني أذار 2025 آذار 2026 شبكة فلسطين للأنباء,19,2026-03
  أوتشا  تحذر : التصعيد الإقليمي ينعكس بشكل مباشر على الأوضاع الإنسانية في الضفة الغربية وغزة - شبكة فلسطين للأنباء,Israel,2026-03-03 09:45:00,https://www.shfanews.net/post/268148,أوتشا تحذر التصعيد الإقليمي ينعكس بشكل مباشر على الأوضاع الإنسانية في الضفة الغربية وغزة شبكة فلسطين للأنباء,17,2026-03
الاتحاد الأوروبي يقدم 8 ملايين يورو لمصر لدعم الفئات الأكثر احتياجًا,Egypt,2026-03-16 14:15:00,https://www.dostor.org/5460974,الاتحاد الأوروبي يقدم 8 ملايين يورو لمصر لدعم الفئات الأكثر احتياج ا,12,2026-03
Israel closes Rafah crossing and all other checkpoints in the West Bank and Gaza Strip,Israel,2026-03-01 15:00:00,https://www.middleeasteye.net/news/israel-closes-rafah-crossing-checkpoint-west-bank-gaza-strip,israel closes rafah crossing and all other checkpoints in the west bank and gaza strip,15,2026-03
"Türkiyeye öğrenime gelen Filistinli öğrenciler , ülkelerindeki ramazan atmosferini anlattı",Turkey,2026-03-03 09:15:00,https://www.aa.com.tr/tr/gundem/turkiyeye-ogrenime-gelen-filistinli-ogrenciler-ulkelerindeki-ramazan-atmosferini-anlatti/3847718,türkiyeye öğrenime gelen filistinli öğrenciler ülkelerindeki ramazan atmosferini anlattı,9,2026-03
 « انسوا التطبيع ».. رئيس الاستخبارات السعودية الأسبق يفضح دوافع نتنياهو فى حربه ضد إيران : قد تحدثتِ عن الكلب والذيل ( فيديو ) ,Egypt,2026-03-04 23:45:00,https://www.almasryalyoum.com/news/details/4214250,انسوا التطبيع رئيس الاستخبارات السعودية الأسبق يفضح دوافع نتنياهو فى حربه ضد إيران قد تحدثت عن الكلب والذيل فيديو,19,2026-03
المنشية .. قرية مهجّرة على تخوم ساحل عكا,Israel,2026-03-03 21:15:00,https://www.addustour.com/articles/1552169-%D8%A7%D9%84%D9%85%D9%86%D8%B4%D9%8A%D8%A9-%D9%82%D8%B1%D9%8A%D8%A9-%D9%85%D9%87%D8%AC%D9%91%D8%B1%D8%A9-%D8%B9%D9%84%D9%89-%D8%AA%D8%AE%D9%88%D9%85-%D8%B3%D8%A7%D8%AD%D9%84-%D8%B9%D9%83%D8%A7,المنشية قرية مهج رة على تخوم ساحل عكا,8,2026-03
"Türkiyede okuyan Filistinli öğrenciler , ülkelerindeki ramazan atmosferini anlattı",Turkey,2026-03-03 18:30:00,https://www.risalehaber.com/turkiyede-okuyan-filistinli-ogrenciler-ulkelerindeki-ramazan-atmosferini-anlatti-451020h.htm,türkiyede okuyan filistinli öğrenciler ülkelerindeki ramazan atmosferini anlattı,8,2026-03
بن غفير : سكان جميع الأحياء اليهودية بالقدس مؤهلين للحصول على رخصة سلاح - شبكة فلسطين للأنباء,Israel,2026-03-09 13:00:00,https://www.shfanews.net/post/269382,بن غفير سكان جميع الأحياء اليهودية بالقدس مؤهلين للحصول على رخصة سلاح شبكة فلسطين للأنباء,15,2026-03
President Abbas discusses regional escalation with Greek Prime Minister,Israel,2026-03-06 14:30:00,https://english.wafa.ps/Pages/Details/168071,president abbas discusses regional escalation with greek prime minister,9,2026-03
عباس يطلع بابا الفاتيكان على خطورة الأوضاع بالأراضي الفلسطينية,Egypt,2026-03-16 18:00:00,https://www.dostor.org/5461257,عباس يطلع بابا الفاتيكان على خطورة الأوضاع بالأراضي الفلسطينية,9,2026-03
تصعيد الأطماع الإسرائيلية .. بين الأساطير التوراتية وقواعد القانون الدولى - أيمن النحراوى,Egypt,2026-03-01 23:15:00,https://www.shorouknews.com/columns/view.aspx?cdate=02032026&id=f2b381de-6d1f-41dd-a578-c624a0b7de7b,تصعيد الأطماع الإسرائيلية بين الأساطير التوراتية وقواعد القانون الدولى أيمن النحراوى,11,2026-03
مدى : 65 انتهاك ضد الحريات الإعلامية في فلسطين خلال شهر شباط الماضي,Israel,2026-03-03 10:15:00,https://www.raya.ps/news/1212928.html,مدى 65 انتهاك ضد الحريات الإعلامية في فلسطين خلال شهر شباط الماضي,12,2026-03
World News : Israeli attack claims three lives in Gaza as regional offensives escalate,United States,2026-03-14 00:45:00,https://www.gdnonline.com:443/Details/1378544,world news israeli attack claims three lives in gaza as regional offensives escalate,13,2026-03
World News : Israeli attack claims three lives in Gaza as regional offensives escalate,United States,2026-03-14 03:00:00,https://www.gdnonline.com:443/Details/1378544/Israeli-attack-claims-three-lives-in-Gaza-as-regional-offensives-escalate,world news israeli attack claims three lives in gaza as regional offensives escalate,13,2026-03
ANFİDAPtan Gazze Tutum Belgesi ! - ,Turkey,2026-03-04 15:15:00,https://dogruhaber.com.tr/anfidaptan-gazze-tutum-belgesi-garantorluk-ve-adalet-olmadan-kalici-baris-mumkun-degil,anfi daptan gazze tutum belgesi,5,2026-03
Son dakika ... Cumhurbaşkanı Erdoğandan önemli açıklamalar,Turkey,2026-03-09 20:15:00,https://www.ozgurkocaeli.com.tr/haber/27601726/son-dakika-cumhurbaskani-erdogandan-onemli-aciklamalar,son dakika cumhurbaşkanı erdoğandan önemli açıklamalar,6,2026-03
Mazlumun yanında zulmün karşısındayız,Turkey,2026-03-14 07:00:00,https://www.sabah.com.tr/gundem/2026/03/14/mazlumun-yaninda-zulmun-karsisindayiz,mazlumun yanında zulmün karşısındayız,4,2026-03
AK Parti İstanbulda Filistin iftarı : Kudüs ve Gazze için birlik mesajı,Turkey,2026-03-15 23:00:00,https://www.sabah.com.tr/gundem/2026/03/15/ak-parti-istanbulda-filistin-iftari-kudus-ve-gazze-icin-birlik-mesaji,ak parti i stanbulda filistin iftarı kudüs ve gazze için birlik mesajı,12,2026-03
الرئيس محمود عباس يبحث هاتفياً مع بابا الفاتيكان آخر تطورات الأوضاع في الأراضي الفلسطينية والمنطقة - شبكة فلسطين للأنباء,Israel,2026-03-16 14:30:00,https://www.shfanews.net/post/270454,الرئيس محمود عباس يبحث هاتفيا مع بابا الفاتيكان آخر تطورات الأوضاع في الأراضي الفلسطينية والمنطقة شبكة فلسطين للأنباء,18,2026-03
Kalyon Kültürde Filistine destek amacıyla  Sessiz Ayakkabılar  sergisi açıldı,Turkey,2026-03-13 12:45:00,https://www.haberler.com/guncel/gazze-deki-acilarin-izleri-sessiz-ayakkabilar-sergisiyle-gun-yuzune-cikiyor-19654299-haberi/,kalyon kültürde filistine destek amacıyla sessiz ayakkabılar sergisi açıldı,9,2026-03
Filistin : İsrailin Batı Şeriada bir aileyi katletmesi bölgesel gerginliği fırsat bilen saldırılarının bir parçası,Turkey,2026-03-15 12:00:00,https://www.haberler.com/guncel/israil-ordusunun-filistinli-aileye-yonelik-saldirisi-kinandi-19660106-haberi/,filistin i srailin batı şeriada bir aileyi katletmesi bölgesel gerginliği fırsat bilen saldırılarının bir parçası,15,2026-03
Cumhurbaşkanı Erdoğan : Filistini unutmuyoruz,Turkey,2026-03-13 18:30:00,https://www.internethaber.com/cumhurbaskani-erdogan-filistini-unutmuyoruz-2435213h.htm,cumhurbaşkanı erdoğan filistini unutmuyoruz,4,2026-03
Berlin Police Chief has links to evangelical Israel lobbyists – Middle East Monitor,Israel,2026-03-07 20:30:00,https://www.middleeastmonitor.com/20260307-berlins-police-chief-has-links-to-evangelical-israel-lobbyists/,berlin police chief has links to evangelical israel lobbyists middle east monitor,12,2026-03
UNRWA Chief : Education Access Under Attack in Palestine,United States,2026-03-03 10:45:00,https://www.miragenews.com/unrwa-chief-education-access-under-attack-in-1629854/,unrwa chief education access under attack in palestine,8,2026-03
Kalyon Kültürde Filistine destek amacıyla  Sessiz Ayakkabılar  sergisi açıldı,Turkey,2026-03-14 09:45:00,https://www.gunes.com/sanat/kalyon-kulturde-filistine-destek-amaciyla-sessiz-ayakkabilar-sergisi-acildi-1225666,kalyon kültürde filistine destek amacıyla sessiz ayakkabılar sergisi açıldı,9,2026-03
Kalyon Kültürde Filistine destek amacıyla  Sessiz Ayakkabılar  sergisi açıldı,Turkey,2026-03-13 16:45:00,https://www.sabah.com.tr/yasam/kalyon-kulturde-filistine-destek-amaciyla-sessiz-ayakkabilar-sergisi-acildi-7542542,kalyon kültürde filistine destek amacıyla sessiz ayakkabılar sergisi açıldı,9,2026-03
أسعار الغاز والمحروقات في فلسطين لشهر 3 مارس / آذار 2026,Israel,2026-03-01 00:45:00,https://www.raya.ps/news/1212779.html,أسعار الغاز والمحروقات في فلسطين لشهر 3 مارس آذار 2026,10,2026-03
"Filistin topraklarını gasbeden İsrailliler , Batı Şeriada Filistinlilerin evlerine saldırdı , hayvanlarını çaldı",Turkey,2026-03-09 10:45:00,http://www.haberler.com/guncel/israil-in-bati-seria-daki-saldirilari-devam-ediyor-19639862-haberi/,filistin topraklarını gasbeden i srailliler batı şeriada filistinlilerin evlerine saldırdı hayvanlarını çaldı,12,2026-03
تقرير : الحرب الاقليمية بين اسرائيل وايران : تداعيات تتجاوز الحدود واثار سلبية على فلسطين ولبنان,Israel,2026-03-07 08:30:00,https://pnn.ps/news/720470,تقرير الحرب الاقليمية بين اسرائيل وايران تداعيات تتجاوز الحدود واثار سلبية على فلسطين ولبنان,14,2026-03
بنك الأردن يدعم جمعية عطاء فلسطين لتوزيع طرود غذائية على عائلات نازحة في قطاع غزة – تلفزيون الفجر,Israel,2026-03-15 10:45:00,https://alfajertv.com/news/palnews/722765.html,بنك الأردن يدعم جمعية عطاء فلسطين لتوزيع طرود غذائية على عائلات نازحة في قطاع غزة تلفزيون الفجر,17,2026-03
